{"active_accounts":["acct.paper.01","acct.paper.02"],"as_of_time":"2026-09-01T20:00:00Z","content_hash":"dddddddddddddddddddddddddddddddddddddddddddddddddddddddddddddddd","created_at":"2026-09-01T20:01:00Z","diagnostics":[],"event_window":{"first_event_time":"2026-09-01T13:30:00Z","last_event_time":"2026-09-01T20:00:00Z","window_kind":"full_day_session"},"ledger_balance_fingerprint":"ffffffffffffffffffffffffffffffffffffffffffffffffffffffffffffffff","manifest_id":"snapshot.2026-09-01.eod","positions_fingerprint":"eeeeeeeeeeeeeeeeeeeeeeeeeeeeeeeeeeeeeeeeeeeeeeeeeeeeeeeeeeeeeeee","retained_event_count":5000,"snapshot_schema_version":1,"source_event_count":5000}
